Title,Rating,Body,Review_Text,Sentiment,word_count,char_count,exclam_count,ques_count
The phone keeps showing a black screen with logo,1,"The phone keeps showing a black screen with logo. And doesn't allow to use the phone even after multiple  tapping on screen or trying to use the fingerprint sensor. It takes almost 2-5 minutes for it to allow to use the phone. The issue persists while tge phone is in use or even when left idle. Hence the battery keeps draining. I tried restarting the phone but it didn't help. But the worst of all was that I switched off the phone, but the phone just turned on on its own. So their switch off doesn't work.","The phone keeps showing a black screen with logo. And doesn't allow to use the phone even after multiple  tapping on screen or trying to use the fingerprint sensor. It takes almost 2-5 minutes for it to allow to use the phone. The issue persists while tge phone is in use or even when left idle. Hence the battery keeps draining. I tried restarting the phone but it didn't help. But the worst of all was that I switched off the phone, but the phone just turned on on its own. So their switch off doesn't work.",Negative,97,509,0,0
Value for Money,5,"The media could not be loaded.
                




   Such good features at this price range makes it a great value for money prospect.Pros:1. Good camera quality.2. phone works without any lags even when more than 3 applications are running.3. Finger print on the side is a great feature and extremely useful than in screen or at the back.Cons:1. Samsung could have invested a little more in the UI but apart from that rest is good.","The media could not be loaded.
                




   Such good features at this price range makes it a great value for money prospect.Pros:1. Good camera quality.2. phone works without any lags even when more than 3 applications are running.3. Finger print on the side is a great feature and extremely useful than in screen or at the back.Cons:1. Samsung could have invested a little more in the UI but apart from that rest is good.",Positive,73,434,0,0
Not worth...don't have enough basic features...6000 mah I doubt it,1,"Biggest disappointment is this latest phone  ,not able to connect to 5g, even my old moto phone am able connect to 5g wifi...also see the numeric pad display ... battery life average...check if I can replace it with other model","Biggest disappointment is this latest phone  ,not able to connect to 5g, even my old moto phone am able connect to 5g wifi...also see the numeric pad display ... battery life average...check if I can replace it with other model",Negative,40,227,0,0
Wonderful phone with minimal Cost,5,"My husband gifted this phone to my Mother. And she just love it. As we all know, Samsung is very user friendly . Any elder person who doesn’t know much about smart phones also can handle it very easily. We ordered blue one And the colour is lovely too. Any one who want 100% latest features with minimal cost can blindly go for it.","My husband gifted this phone to my Mother. And she just love it. As we all know, Samsung is very user friendly . Any elder person who doesn’t know much about smart phones also can handle it very easily. We ordered blue one And the colour is lovely too. Any one who want 100% latest features with minimal cost can blindly go for it.",Positive,64,331,0,0
Nice phone at that range,4,Nice phone....having long battery life upto 2 to 3 days on one charging... because of 6000mah battery its a bit heavier but fingerprint scanner is on lock key that is awesome thing I have seen......camera is decent too... special selfie camera bright and clear...overall nice phone,Nice phone....having long battery life upto 2 to 3 days on one charging... because of 6000mah battery its a bit heavier but fingerprint scanner is on lock key that is awesome thing I have seen......camera is decent too... special selfie camera bright and clear...overall nice phone,Positive,46,281,0,0
Worst Camera by Samsung and network problem.,2,"Is this 48MP by Samsung. The real reason why Samsung is losing to Xiaomi is this. Please do not buy this if camera is important for you.It cannot detect wifi from exactly the same location from where my Samsung On7 Pro can, Redmi 9 can and all others can. Please note that M21 and M12 have network detecting issue.","Is this 48MP by Samsung. The real reason why Samsung is losing to Xiaomi is this. Please do not buy this if camera is important for you.It cannot detect wifi from exactly the same location from where my Samsung On7 Pro can, Redmi 9 can and all others can. Please note that M21 and M12 have network detecting issue.",Negative,59,314,0,0
The only Good One in M series🙄,5,Pros-•Good Battery Life•Good Camera (Back)(Better than M11🙄)•Z Plus Ram(excess ram more than 4GB IF NEEDED)•90Hz adaptive refresh rate•Smooth PerformanceCons-•Front Camera is Average•Too Many Useless apps When you First Buy it•Back Camera not suitable for Night condition•Saturation of Camera is Too High,Pros-•Good Battery Life•Good Camera (Back)(Better than M11🙄)•Z Plus Ram(excess ram more than 4GB IF NEEDED)•90Hz adaptive refresh rate•Smooth PerformanceCons-•Front Camera is Average•Too Many Useless apps When you First Buy it•Back Camera not suitable for Night condition•Saturation of Camera is Too High,Positive,41,304,0,0
Good phone,4,The phone is very goodBattery life is goodCamera is very goodTechnology is goodSamsung service is good for this good phoneOverall it a nice phone  but display quality is very poor  so this phone is good for in its price list.,The phone is very goodBattery life is goodCamera is very goodTechnology is goodSamsung service is good for this good phoneOverall it a nice phone  but display quality is very poor  so this phone is good for in its price list.,Positive,40,225,0,0
Phone to achcha hai but….,4,"Phone to achcha hai. Main Sri lanka se, par India se mangvaya. rs9499 mei to value lagta hai. Lkn camera 48 hone par b dooor ke fotos ki pictures quality to theek nh. But selfie aur normal distance ke fotos  to theek hai. Meine ise online classes ke liye kharida. So iske liye theek laga. Face ID to andhere me kaam nhi karta. Battery bhi theek hai. Abhi 5dinon se classes ke lie use kia. Aur kya kahun? Amazon me jo b details dekha use dekh kar kharida. Ummid thodi si thi ki camera ke bare me. Iske alawa overall theek hai.","Phone to achcha hai. Main Sri lanka se, par India se mangvaya. rs9499 mei to value lagta hai. Lkn camera 48 hone par b dooor ke fotos ki pictures quality to theek nh. But selfie aur normal distance ke fotos  to theek hai. Meine ise online classes ke liye kharida. So iske liye theek laga. Face ID to andhere me kaam nhi karta. Battery bhi theek hai. Abhi 5dinon se classes ke lie use kia. Aur kya kahun? Amazon me jo b details dekha use dekh kar kharida. Ummid thodi si thi ki camera ke bare me. Iske alawa overall theek hai.",Positive,102,525,0,1
Don't buy this phone,1,The camera is of very poor quality.Screen disply quality is not good as redmi phone don't buy this phone.I will never purchase any Samsung phone in future.Samsung is only doing marketing launching new products every day but quality of the product are very poor.I replaced the redi phone if you used the redimi phone you will never satisfied with Samsung.,The camera is of very poor quality.Screen disply quality is not good as redmi phone don't buy this phone.I will never purchase any Samsung phone in future.Samsung is only doing marketing launching new products every day but quality of the product are very poor.I replaced the redi phone if you used the redimi phone you will never satisfied with Samsung.,Negative,60,354,0,0
Pathetic Product from Samsung,5,I had bought this phone for my mom and it had severe call quality issues from the beginning and within 6 months of using it the fingerprint stopped working. I checked with the service centre and they told me that the phone had liquid damage although it never had contact with water or rain. Stay away from this garbage.,I had bought this phone for my mom and it had severe call quality issues from the beginning and within 6 months of using it the fingerprint stopped working. I checked with the service centre and they told me that the phone had liquid damage although it never had contact with water or rain. Stay away from this garbage.,Positive,59,319,0,0
Camera quality. Donn't waste your money on M12,1,"Total waste of money. Worst camera quality. Front camera is not even like like 1 megapixel camera. If you like to take even a single selfi, then don't go for it. Back camera is also not at all good. My old Samsung phones are far better than this one. Once you buy you have to live with it. So, don't waste your money on this M12","Total waste of money. Worst camera quality. Front camera is not even like like 1 megapixel camera. If you like to take even a single selfi, then don't go for it. Back camera is also not at all good. My old Samsung phones are far better than this one. Once you buy you have to live with it. So, don't waste your money on this M12",Negative,66,328,0,0
Nice product,4,Nice product with in the price range with better battery back up. Camera quality is good..The only bad thing I observed is that wifi is getting connected 2.5ghz bandwidth networks but not getting connected for 5ghz higher bandwidth networks.. Otherwise I would have given 5.,Nice product with in the price range with better battery back up. Camera quality is good..The only bad thing I observed is that wifi is getting connected 2.5ghz bandwidth networks but not getting connected for 5ghz higher bandwidth networks.. Otherwise I would have given 5.,Positive,45,274,0,0
Not for those in the age group 12-60,1,It is a phone suitable for kids or those who use phone only to make calls and watch videos in youtube. phone is of basic specs and cannot be used for multitasking.it can be used for basic things. nothing more.,It is a phone suitable for kids or those who use phone only to make calls and watch videos in youtube. phone is of basic specs and cannot be used for multitasking.it can be used for basic things. nothing more.,Negative,40,209,0,0
Not bad at these price,3,Loved this color.Cons:* heating issue*screen heating while charging*doesnt feel fast charging ( adapter provided is not 15w)* Not feeling 90 hz refreshing rate* battery drain fast ( not feeling 6000 mah battery life )*weight is little high*sound quality is not good (sometimes cant hear phone ringing) Pros:Camera quality goodVideo quality goodNice colorGood at this price (brought @10499)On time deliveryHope build quality of Samsung will be good,Loved this color.Cons:* heating issue*screen heating while charging*doesnt feel fast charging ( adapter provided is not 15w)* Not feeling 90 hz refreshing rate* battery drain fast ( not feeling 6000 mah battery life )*weight is little high*sound quality is not good (sometimes cant hear phone ringing) Pros:Camera quality goodVideo quality goodNice colorGood at this price (brought @10499)On time deliveryHope build quality of Samsung will be good,Neutral,66,447,0,0
Very low quality product from Samsung compared to their other products,2,The M12 is very low quality product in terms of display which has very faded colors and the screen is a magnet for fingerprints and other forms of dirt.It does not even have high speed WiFi (5Ghz) which I was expecting.Compared this to very marginally higher priced M21 which is leaps ahead in terms of specs and product quality.,The M12 is very low quality product in terms of display which has very faded colors and the screen is a magnet for fingerprints and other forms of dirt.It does not even have high speed WiFi (5Ghz) which I was expecting.Compared this to very marginally higher priced M21 which is leaps ahead in terms of specs and product quality.,Negative,59,329,0,0
Not very impressive,2,Below average phone in this price range. Battery lasts only 24hrs with very normal use. Camera is below standards. Processor is not very impressive. Mi Note 10 would have been a better choice.,Below average phone in this price range. Battery lasts only 24hrs with very normal use. Camera is below standards. Processor is not very impressive. Mi Note 10 would have been a better choice.,Negative,33,192,0,0
Very Good For Normal Users,4,"The Phone is best for middle range buyers,Negative in phone means 1000/2000 price has to reduce because of their given features .And remaining over is fine with mid rangeFingerprint is fastBattery is very goodCamera back is okay but front 8mp is some what good (because of this price has to reduce)Processor is not good for gamers.,This phone is very good to who use very less .,or normal users .  Like only calls msgs and social networks chatting.If you want camera good means don't buy this phone.Screen resolution is less due to that HD videos were not in original some what blur or like below HD.","The Phone is best for middle range buyers,Negative in phone means 1000/2000 price has to reduce because of their given features .And remaining over is fine with mid rangeFingerprint is fastBattery is very goodCamera back is okay but front 8mp is some what good (because of this price has to reduce)Processor is not good for gamers.,This phone is very good to who use very less .,or normal users .  Like only calls msgs and social networks chatting.If you want camera good means don't buy this phone.Screen resolution is less due to that HD videos were not in original some what blur or like below HD.",Positive,105,600,0,0
Internet Problem (Value for money),3,There is only 1 problem I observed that  the internet is not working properly. Videos are running intermittently even on high speed Wi-Fi. Web pages also does not load as expected.Other than that working fine and all the expected feature in this range. Its fingerprint sensor in power button.,There is only 1 problem I observed that  the internet is not working properly. Videos are running intermittently even on high speed Wi-Fi. Web pages also does not load as expected.Other than that working fine and all the expected feature in this range. Its fingerprint sensor in power button.,Neutral,49,292,0,0
Best phone in Best prise among all other chinies brand.,5,Good batry backupGood Camera  for this range i have seen all other phone in this range but samsung is the best in camera.Buildup quality is feel like mid range phoneScreen is so nice like amoledSound output is so clear and punchy.Samsung UI is better all other chinies smart phone.Screen is very big phone waight distribution is very comfirty.If you wana give this phone to your love one i will 100% recomend you trust me you will never regreatI have also buy 2 quantity for personal and home uses.I got it in 8549 in festive sale with HDFC credit card,Good batry backupGood Camera  for this range i have seen all other phone in this range but samsung is the best in camera.Buildup quality is feel like mid range phoneScreen is so nice like amoledSound output is so clear and punchy.Samsung UI is better all other chinies smart phone.Screen is very big phone waight distribution is very comfirty.If you wana give this phone to your love one i will 100% recomend you trust me you will never regreatI have also buy 2 quantity for personal and home uses.I got it in 8549 in festive sale with HDFC credit card,Positive,99,552,0,0
Worst Phone I have ever Seen with this price.,1,"Worst Phone I have ever Seen with this price. Nothing is good except battery. Camera quality is very poor, Phone is very heavy, Sound quality is very poor. I will never recommend to anyone to buy Samsung Phone. One of my friend had recommended to go with Samsung phone. I think he has no idea about the quality of phone.","Worst Phone I have ever Seen with this price. Nothing is good except battery. Camera quality is very poor, Phone is very heavy, Sound quality is very poor. I will never recommend to anyone to buy Samsung Phone. One of my friend had recommended to go with Samsung phone. I think he has no idea about the quality of phone.",Negative,60,320,0,0
Poor battery,1,Bad product heavy weight if you use one plus. I bought this for mailing and what's app so it's working ok. At this price it's a quality product but don't expect performance like one plus or high priced phones. Battery life doesn't seems to perform like 6000 it's bad,Bad product heavy weight if you use one plus. I bought this for mailing and what's app so it's working ok. At this price it's a quality product but don't expect performance like one plus or high priced phones. Battery life doesn't seems to perform like 6000 it's bad,Negative,49,266,0,0
Bang for a Buck,5,"People who are judging this without realizing it's price needs to calm down. I bought this for my cousin during Great Indian Festival at Rs. 8600. Excellent product, Clean Samsung UI which is the best in the world, 90 Hz refresh rate which is working fine without any lag, Battery backup is real good. People who are saying camera needs improvement, they are not gonna give you Flagship level camera in the phone which is less than 10000 Rs. If you want cleaner UI, you can definitely buy this. & it's stupidity to judge a phone by Gaming performance. This phone is a daily driver & not a gaming device.","People who are judging this without realizing it's price needs to calm down. I bought this for my cousin during Great Indian Festival at Rs. 8600. Excellent product, Clean Samsung UI which is the best in the world, 90 Hz refresh rate which is working fine without any lag, Battery backup is real good. People who are saying camera needs improvement, they are not gonna give you Flagship level camera in the phone which is less than 10000 Rs. If you want cleaner UI, you can definitely buy this. & it's stupidity to judge a phone by Gaming performance. This phone is a daily driver & not a gaming device.",Positive,110,603,0,0
Excellent product within this price range. Battery back up is unimaginable .,5,Samsung Galaxy M12 is an excellent handset. I am writing this review after of using the mobile for three weeks. The battery back up is unimaginable . Once it gets fully charged it runs for around 40 hours with frequent usage of internet. This set consists every unique feature that Samsung offers. The camera is good but not excellent. Nevertheless the sound of loudspeaker is little down. That is to say if the volume is not highest then it becomes a bit hard to listen.To conclude i would say that the configuration which this handset consists within this price range is just beyond imagination. This is an excellent handset Samsung launched.,Samsung Galaxy M12 is an excellent handset. I am writing this review after of using the mobile for three weeks. The battery back up is unimaginable . Once it gets fully charged it runs for around 40 hours with frequent usage of internet. This set consists every unique feature that Samsung offers. The camera is good but not excellent. Nevertheless the sound of loudspeaker is little down. That is to say if the volume is not highest then it becomes a bit hard to listen.To conclude i would say that the configuration which this handset consists within this price range is just beyond imagination. This is an excellent handset Samsung launched.,Positive,111,644,0,0
Very good at this price,4,"The media could not be loaded.
                




   Very good, Don't dwell on the negetive review. Camera is pretty good, UI is very user friendly, Fingerprint sensor is at side on the lock screen button so no back side look is clean & the sensor works perfectly and flawlessly. Long battery life.","The media could not be loaded.
                




   Very good, Don't dwell on the negetive review. Camera is pretty good, UI is very user friendly, Fingerprint sensor is at side on the lock screen button so no back side look is clean & the sensor works perfectly and flawlessly. Long battery life.",Positive,50,300,0,0
Mid range good quality.12 hajar ke andar acchi mobile h,4,This is good product battery life is awesome internal memory is good 128GB good for gaming is mid range mobile.lttle bit heavy weight. Acchi mobile hai 12 hajar ke andar game khelne k liye v best hai.battery v bahut chalti hai.but camera utna accha nahi h.baki sab thik h wajan thoda jyada hai,This is good product battery life is awesome internal memory is good 128GB good for gaming is mid range mobile.lttle bit heavy weight. Acchi mobile hai 12 hajar ke andar game khelne k liye v best hai.battery v bahut chalti hai.but camera utna accha nahi h.baki sab thik h wajan thoda jyada hai,Positive,53,293,0,0
not even for a single star,1,"Samsung is simply cheating customers by booming the non credible features , the given features are just a paper tiger ( only for advertising ) don't misunderstand it will perform. it is just a budget phone nothing rather thanDon't think against the given features by Samsung . if you need a budget phone , can buy it else if you want a performance phone please Don'tOnly battery is good","Samsung is simply cheating customers by booming the non credible features , the given features are just a paper tiger ( only for advertising ) don't misunderstand it will perform. it is just a budget phone nothing rather thanDon't think against the given features by Samsung . if you need a budget phone , can buy it else if you want a performance phone please Don'tOnly battery is good",Negative,69,386,0,0
Value for money,1,bought on  Amazon festival sale. After 10 days received phone. To my surprise phone was not charging and on trouble shooting found issue in charging cable. Didn't expect this quality from Samsung. Delay  of delivery is pinching too. I could have bought in a in person store and avoided all these hassles. raised return but didn't get call even after 15days was forced to used phone and buy my own cable. if something goes wrong only god can save.. don't trust amazon nor these vendors.. amazon stopped picking my support calls.,bought on  Amazon festival sale. After 10 days received phone. To my surprise phone was not charging and on trouble shooting found issue in charging cable. Didn't expect this quality from Samsung. Delay  of delivery is pinching too. I could have bought in a in person store and avoided all these hassles. raised return but didn't get call even after 15days was forced to used phone and buy my own cable. if something goes wrong only god can save.. don't trust amazon nor these vendors.. amazon stopped picking my support calls.,Negative,91,527,0,0
Satisfied,4,"Galaxy M12 review after 2 weeksPros:Battery lifeOperating system (one ui core)90hz bright displayDecent camera qualityWeight distribution was good,feels lightDesign looks goodCons:1.Not sure with performance,day to day tasks are quite good,but for gaming i think it os not suitable2.Camera doesn't have fancy features but still fineFinally at low expectations i bought this product to my mom but i like it more than my phone for some time.Samsung is a brand.I had disabled most of ads,blotware and heavy apps in order to give best experience.Best for day to day use ☺️","Galaxy M12 review after 2 weeksPros:Battery lifeOperating system (one ui core)90hz bright displayDecent camera qualityWeight distribution was good,feels lightDesign looks goodCons:1.Not sure with performance,day to day tasks are quite good,but for gaming i think it os not suitable2.Camera doesn't have fancy features but still fineFinally at low expectations i bought this product to my mom but i like it more than my phone for some time.Samsung is a brand.I had disabled most of ads,blotware and heavy apps in order to give best experience.Best for day to day use ☺️",Positive,89,568,0,0
Performs much better than was expected after reading the reviews.,5,"Camera quality is good if compared to other phones in this range. Phone feels really fast, thanks to the 90Hz screen and 6gb RAM with a fast processor. I bought in under exchange offer for 10,000 ( 6gb variant ) and I am quite satisfied with my purchase. Go for it if you are tight on a budget yet want a phone with good specs. Much better than similar budget Chinese phones. But note that front camera could have been better, although it is 8mp but still gives grainy images. Phone was delivered in perfectly new condition.","Camera quality is good if compared to other phones in this range. Phone feels really fast, thanks to the 90Hz screen and 6gb RAM with a fast processor. I bought in under exchange offer for 10,000 ( 6gb variant ) and I am quite satisfied with my purchase. Go for it if you are tight on a budget yet want a phone with good specs. Much better than similar budget Chinese phones. But note that front camera could have been better, although it is 8mp but still gives grainy images. Phone was delivered in perfectly new condition.",Positive,97,524,0,0
Weak point,3,The weak point is camera both side is really not so good an average quality of camera but Okey!Second one is charging speed is tooo slow 15 W 😂 about 3 hours + take to full up!But I brought for my uncle so I think this was the best smartphone for him..Under 10k superb smartphone.(Grate indian festival sale offer),The weak point is camera both side is really not so good an average quality of camera but Okey!Second one is charging speed is tooo slow 15 W 😂 about 3 hours + take to full up!But I brought for my uncle so I think this was the best smartphone for him..Under 10k superb smartphone.(Grate indian festival sale offer),Neutral,59,314,2,0
